{
  "schemaVersion": 1,
  "createdAt": "2026-07-24T12:10:00.000Z",
  "command": { "id": "verify", "version": 1 },
  "subject": { "commit": "fedcba9876543210", "dirty": false },
  "fingerprints": {
    "environment": "environment_sha256:stale-example",
    "providerPosture": "provider_sha256:fake-example"
  },
  "scope": {
    "kind": "focused",
    "changedPaths": ["tooling/agent-pack"],
    "partial": true
  },
  "gates": [
    {
      "gateId": "check:agent-pack",
      "posture": "required",
      "evidenceClass": "behavioral",
      "status": "pass",
      "semanticRuleIds": []
    }
  ]
}
